{
  "formatVersion": 1,
  "projectId": "34c88131-825e-4d22-a9b9-320971daf812",
  "revision": 5,
  "requiredCapabilities": [
    "region-v0",
    "mesh-v1"
  ],
  "metadata": {
    "name": "Gate2 scarf"
  },
  "assets": [
    {
      "id": "scarf",
      "name": "scarf",
      "path": "assets/scarf.png",
      "mimeType": "image/png",
      "sha256": "d16a903fb3e97e214c13e1b79a9c6e3cee417e2ddf6c524086eb7ee27c8dcbc2",
      "pixelWidth": 256,
      "pixelHeight": 96,
      "originalWidth": 256,
      "originalHeight": 96,
      "trimX": 0,
      "trimY": 0
    }
  ],
  "bones": [
    {
      "id": "root",
      "name": "root",
      "parentId": null,
      "setup": {
        "x": 0,
        "y": 0,
        "rotation": -0.3490658503988659,
        "scaleX": 1,
        "scaleY": 1
      }
    },
    {
      "id": "mid",
      "name": "mid",
      "parentId": "root",
      "setup": {
        "x": 0,
        "y": 0,
        "rotation": 0,
        "scaleX": 1,
        "scaleY": 1
      }
    },
    {
      "id": "tip",
      "name": "tip",
      "parentId": "root",
      "setup": {
        "x": 0,
        "y": 0,
        "rotation": 0,
        "scaleX": 1,
        "scaleY": 1
      }
    }
  ],
  "slots": [
    {
      "id": "mesh",
      "name": "Mesh",
      "boneId": "root",
      "attachmentId": "mesh"
    }
  ],
  "attachments": [
    {
      "id": "mesh",
      "type": "mesh",
      "assetId": "scarf",
      "vertices": [
        0,
        28.8,
        9.6,
        28.8,
        19.2,
        28.8,
        28.799999999999997,
        28.8,
        38.4,
        28.8,
        48,
        28.8,
        57.599999999999994,
        28.8,
        67.2,
        28.8,
        76.8,
        28.8,
        86.39999999999999,
        28.8,
        96,
        28.8,
        105.6,
        28.8,
        115.19999999999999,
        28.8,
        124.8,
        28.8,
        134.4,
        28.8,
        144,
        28.8,
        153.6,
        28.8,
        0,
        14.4,
        9.6,
        14.4,
        19.2,
        14.4,
        28.799999999999997,
        14.4,
        38.4,
        14.4,
        48,
        14.4,
        57.599999999999994,
        14.4,
        67.2,
        14.4,
        76.8,
        14.4,
        86.39999999999999,
        14.4,
        96,
        14.4,
        105.6,
        14.4,
        115.19999999999999,
        14.4,
        124.8,
        14.4,
        134.4,
        14.4,
        144,
        14.4,
        153.6,
        14.4,
        0,
        0,
        9.6,
        0,
        19.2,
        0,
        28.799999999999997,
        0,
        38.4,
        0,
        48,
        0,
        57.599999999999994,
        0,
        67.2,
        0,
        76.8,
        0,
        86.39999999999999,
        0,
        96,
        0,
        105.6,
        0,
        115.19999999999999,
        0,
        124.8,
        0,
        134.4,
        0,
        144,
        0,
        153.6,
        0,
        0,
        -14.4,
        9.6,
        -14.4,
        19.2,
        -14.4,
        28.799999999999997,
        -14.4,
        38.4,
        -14.4,
        48,
        -14.4,
        57.599999999999994,
        -14.4,
        67.2,
        -14.4,
        76.8,
        -14.4,
        86.39999999999999,
        -14.4,
        96,
        -14.4,
        105.6,
        -14.4,
        115.19999999999999,
        -14.4,
        124.8,
        -14.4,
        134.4,
        -14.4,
        144,
        -14.4,
        153.6,
        -14.4,
        0,
        -28.8,
        9.6,
        -28.8,
        19.2,
        -28.8,
        28.799999999999997,
        -28.8,
        38.4,
        -28.8,
        48,
        -28.8,
        57.599999999999994,
        -28.8,
        67.2,
        -28.8,
        76.8,
        -28.8,
        86.39999999999999,
        -28.8,
        96,
        -28.8,
        105.6,
        -28.8,
        115.19999999999999,
        -28.8,
        124.8,
        -28.8,
        134.4,
        -28.8,
        144,
        -28.8,
        153.6,
        -28.8
      ],
      "uvs": [
        0,
        0,
        0.0625,
        0,
        0.125,
        0,
        0.1875,
        0,
        0.25,
        0,
        0.3125,
        0,
        0.375,
        0,
        0.4375,
        0,
        0.5,
        0,
        0.5625,
        0,
        0.625,
        0,
        0.6875,
        0,
        0.75,
        0,
        0.8125,
        0,
        0.875,
        0,
        0.9375,
        0,
        1,
        0,
        0,
        0.25,
        0.0625,
        0.25,
        0.125,
        0.25,
        0.1875,
        0.25,
        0.25,
        0.25,
        0.3125,
        0.25,
        0.375,
        0.25,
        0.4375,
        0.25,
        0.5,
        0.25,
        0.5625,
        0.25,
        0.625,
        0.25,
        0.6875,
        0.25,
        0.75,
        0.25,
        0.8125,
        0.25,
        0.875,
        0.25,
        0.9375,
        0.25,
        1,
        0.25,
        0,
        0.5,
        0.0625,
        0.5,
        0.125,
        0.5,
        0.1875,
        0.5,
        0.25,
        0.5,
        0.3125,
        0.5,
        0.375,
        0.5,
        0.4375,
        0.5,
        0.5,
        0.5,
        0.5625,
        0.5,
        0.625,
        0.5,
        0.6875,
        0.5,
        0.75,
        0.5,
        0.8125,
        0.5,
        0.875,
        0.5,
        0.9375,
        0.5,
        1,
        0.5,
        0,
        0.75,
        0.0625,
        0.75,
        0.125,
        0.75,
        0.1875,
        0.75,
        0.25,
        0.75,
        0.3125,
        0.75,
        0.375,
        0.75,
        0.4375,
        0.75,
        0.5,
        0.75,
        0.5625,
        0.75,
        0.625,
        0.75,
        0.6875,
        0.75,
        0.75,
        0.75,
        0.8125,
        0.75,
        0.875,
        0.75,
        0.9375,
        0.75,
        1,
        0.75,
        0,
        1,
        0.0625,
        1,
        0.125,
        1,
        0.1875,
        1,
        0.25,
        1,
        0.3125,
        1,
        0.375,
        1,
        0.4375,
        1,
        0.5,
        1,
        0.5625,
        1,
        0.625,
        1,
        0.6875,
        1,
        0.75,
        1,
        0.8125,
        1,
        0.875,
        1,
        0.9375,
        1,
        1,
        1
      ],
      "triangles": [
        0,
        1,
        18,
        0,
        18,
        17,
        1,
        2,
        19,
        1,
        19,
        18,
        2,
        3,
        20,
        2,
        20,
        19,
        3,
        4,
        21,
        3,
        21,
        20,
        4,
        5,
        22,
        4,
        22,
        21,
        5,
        6,
        23,
        5,
        23,
        22,
        6,
        7,
        24,
        6,
        24,
        23,
        7,
        8,
        25,
        7,
        25,
        24,
        8,
        9,
        26,
        8,
        26,
        25,
        9,
        10,
        27,
        9,
        27,
        26,
        10,
        11,
        28,
        10,
        28,
        27,
        11,
        12,
        29,
        11,
        29,
        28,
        12,
        13,
        30,
        12,
        30,
        29,
        13,
        14,
        31,
        13,
        31,
        30,
        14,
        15,
        32,
        14,
        32,
        31,
        15,
        16,
        33,
        15,
        33,
        32,
        17,
        18,
        35,
        17,
        35,
        34,
        18,
        19,
        36,
        18,
        36,
        35,
        19,
        20,
        37,
        19,
        37,
        36,
        20,
        21,
        38,
        20,
        38,
        37,
        21,
        22,
        39,
        21,
        39,
        38,
        22,
        23,
        40,
        22,
        40,
        39,
        23,
        24,
        41,
        23,
        41,
        40,
        24,
        25,
        42,
        24,
        42,
        41,
        25,
        26,
        43,
        25,
        43,
        42,
        26,
        27,
        44,
        26,
        44,
        43,
        27,
        28,
        45,
        27,
        45,
        44,
        28,
        29,
        46,
        28,
        46,
        45,
        29,
        30,
        47,
        29,
        47,
        46,
        30,
        31,
        48,
        30,
        48,
        47,
        31,
        32,
        49,
        31,
        49,
        48,
        32,
        33,
        50,
        32,
        50,
        49,
        34,
        35,
        52,
        34,
        52,
        51,
        35,
        36,
        53,
        35,
        53,
        52,
        36,
        37,
        54,
        36,
        54,
        53,
        37,
        38,
        55,
        37,
        55,
        54,
        38,
        39,
        56,
        38,
        56,
        55,
        39,
        40,
        57,
        39,
        57,
        56,
        40,
        41,
        58,
        40,
        58,
        57,
        41,
        42,
        59,
        41,
        59,
        58,
        42,
        43,
        60,
        42,
        60,
        59,
        43,
        44,
        61,
        43,
        61,
        60,
        44,
        45,
        62,
        44,
        62,
        61,
        45,
        46,
        63,
        45,
        63,
        62,
        46,
        47,
        64,
        46,
        64,
        63,
        47,
        48,
        65,
        47,
        65,
        64,
        48,
        49,
        66,
        48,
        66,
        65,
        49,
        50,
        67,
        49,
        67,
        66,
        51,
        52,
        69,
        51,
        69,
        68,
        52,
        53,
        70,
        52,
        70,